{
  "vessel": {
    "name": "Example Tanker",
    "flag": "Panama",
    "vessel_type": "crude oil tanker"
  },
  "voyage": {
    "chokepoint": "strait_of_hormuz",
    "origin": "undisclosed Gulf terminal",
    "destination": "ship-to-ship area, Gulf of Oman"
  },
  "cargo": "crude oil",
  "counterparties": [
    {
      "role": "registered_owner",
      "name": "Example Holding Ltd",
      "jurisdiction": "Marshall Islands"
    },
    {
      "role": "insurer_or_pi_club",
      "name": "Unknown"
    }
  ],
  "exposure_facets": [
    "iran_oil_exposure",
    "dark_fleet_indicators",
    "sts_transfer",
    "insurance_or_pi_gap"
  ],
  "jurisdictions_in_scope": [
    "OFAC",
    "EU",
    "UK_OFSI"
  ],
  "decision_stage": "pre_fixture",
  "dated_sources": [
    {
      "id": "g1",
      "source_type": "ais_track_record",
      "title": "AIS track extract",
      "date": "2026-05-28"
    }
  ],
  "risk_question": "Is this Hormuz transit ready to fix, or should it be escalated before fixture?",
  "requested_output": "structured_json"
}
